{
  "version": 1,
  "documentShortcuts": [
    {
      "id": "runbook",
      "name": "Runbook",
      "path": "RUNBOOK.md",
      "description": "Canonical restart, checkpoint, and recovery protocol."
    },
    {
      "id": "task-state",
      "name": "Task State",
      "path": "TASK_STATE.md",
      "description": "Current checkpoint and resume status for the repo."
    },
    {
      "id": "work-in-progress",
      "name": "Work In Progress",
      "path": "WORK_IN_PROGRESS.md",
      "description": "Current focus, risks, and next milestone."
    },
    {
      "id": "operator-surface",
      "name": "Operator Surface Contract",
      "path": "docs/OPERATOR_SURFACE_CONTRACT.md",
      "description": "Manifest-driven operator/admin surfaces for enterprise runtime owners."
    },
    {
      "id": "enterprise-app-factory-contract",
      "name": "Enterprise App Factory Contract",
      "path": "docs/ENTERPRISE_APP_FACTORY_CONTRACT.md",
      "description": "Typed contract for the internal enterprise builder and generated workspace system."
    },
    {
      "id": "approval-policy",
      "name": "Operator Approval Policy",
      "path": "docs/OPERATOR_APPROVAL_POLICY.md",
      "description": "Approval boundaries for manifest-backed operator actions."
    },
    {
      "id": "network-policy",
      "name": "Network Policy",
      "path": "docs/NETWORK_POLICY.md",
      "description": "Network and approval posture across host, worker, automation, and services."
    },
    {
      "id": "runtime-compatibility",
      "name": "Runtime Profile Compatibility",
      "path": "docs/RUNTIME_PROFILE_COMPATIBILITY.md",
      "description": "Evidence level and implementation status for OpenClaw and NemoClaw surfaces."
    },
    {
      "id": "agentmail-contract",
      "name": "AgentMail Runtime Contract",
      "path": "docs/AGENTMAIL_RUNTIME_CONTRACT.md",
      "description": "Runtime-owned mailbox, domain, and message-envelope contract."
    },
    {
      "id": "agentmail-openclaw-setup",
      "name": "AgentMail OpenClaw Setup",
      "path": "docs/AGENTMAIL_OPENCLAW_SETUP.md",
      "description": "OpenClaw-specific setup and live-proof path for AgentMail."
    },
    {
      "id": "browser-validation-contract",
      "name": "Browser Validation Contract",
      "path": "docs/BROWSER_VALIDATION_CONTRACT.md",
      "description": "Diff-aware browser-proof planning contract for downstream surfaces."
    },
    {
      "id": "enterprise-skill-bundles",
      "name": "Enterprise Skill Bundles",
      "path": "docs/ENTERPRISE_SKILL_BUNDLES.md",
      "description": "Curated bundle catalog for reusable enterprise skill packaging."
    },
    {
      "id": "platform-positioning",
      "name": "Platform Ownership and Positioning",
      "path": "docs/PLATFORM_OWNERSHIP_AND_POSITIONING.md",
      "description": "Partner-owned platform boundaries, provenance, and reusable productization model."
    },
    {
      "id": "delegation-protocol",
      "name": "Worker Delegation Protocol",
      "path": "docs/WORKER_DELEGATION_PROTOCOL.md",
      "description": "Typed host/worker handoff contract."
    }
  ],
  "operatorActions": [
    {
      "id": "doctor-plus",
      "name": "Doctor Plus",
      "command": "node scripts/validate-repo-operating-system.mjs && node scripts/validate-ona-skills.mjs && node scripts/automind-skill-pack.mjs validate && node scripts/automind-routines.mjs validate && node scripts/validate-workflows.mjs && node scripts/validate-runtime-contracts.mjs && node scripts/validate-github-automation.mjs && node scripts/github-autonomy-selftest.mjs && node scripts/validate-downstream-sync.mjs && node scripts/validate-capability-intake.mjs && node scripts/validate-runtime-topology-profiles.mjs && node scripts/validate-operator-surfaces.mjs && node scripts/validate-agentmail-runtime.mjs && node scripts/validate-browser-validation.mjs && node scripts/validate-enterprise-skill-bundles.mjs && node scripts/validate-enterprise-app-factory-contracts.mjs && node scripts/openclaw-fixture-smoke.mjs",
      "capability": "runtime.validate",
      "approvalMode": "allow",
      "ownerSurface": "host",
      "description": "Run the broad repo and runtime sanity check."
    },
    {
      "id": "worker-status",
      "name": "Worker Status",
      "command": "bash ./scripts/worker-status.sh",
      "capability": "runtime.inspect",
      "approvalMode": "allow",
      "ownerSurface": "host",
      "description": "Inspect host/worker routing, seeded state, and continuity files."
    },
    {
      "id": "runtime-doctor",
      "name": "Runtime Doctor",
      "command": "bash ./scripts/runtime-doctor.sh",
      "capability": "runtime.validate",
      "approvalMode": "allow",
      "ownerSurface": "host",
      "description": "Validate core runtime topology, contracts, and policies."
    },
    {
      "id": "repo-validate",
      "name": "Repo Validate",
      "command": "node scripts/validate-repo-operating-system.mjs && node scripts/validate-ona-skills.mjs && node scripts/automind-skill-pack.mjs validate && node scripts/automind-routines.mjs validate && node scripts/validate-workflows.mjs && node scripts/validate-runtime-contracts.mjs && node scripts/validate-github-automation.mjs && node scripts/github-autonomy-selftest.mjs && node scripts/validate-downstream-sync.mjs && node scripts/validate-capability-intake.mjs && node scripts/validate-runtime-topology-profiles.mjs && node scripts/validate-operator-surfaces.mjs && node scripts/validate-agentmail-runtime.mjs && node scripts/validate-browser-validation.mjs && node scripts/validate-enterprise-skill-bundles.mjs && node scripts/validate-enterprise-app-factory-contracts.mjs",
      "capability": "repo.validate",
      "approvalMode": "allow",
      "ownerSurface": "repo",
      "description": "Run the broad repo operating-system and contract validation suite."
    },
    {
      "id": "workflow-validate",
      "name": "Workflow Validate",
      "command": "node scripts/validate-workflows.mjs",
      "capability": "repo.validate",
      "approvalMode": "allow",
      "ownerSurface": "repo",
      "description": "Validate workflow definitions and routing config."
    },
    {
      "id": "diagnostic-test",
      "name": "Diagnostic Tests",
      "command": "npm test --prefix services/diagnostic",
      "capability": "service.validate",
      "approvalMode": "allow",
      "ownerSurface": "repo",
      "description": "Run the diagnostic service test suite."
    },
    {
      "id": "enterprise-app-factory-contract-validate",
      "name": "Enterprise App Factory Contract Validate",
      "command": "node scripts/validate-enterprise-app-factory-contracts.mjs",
      "capability": "repo.validate",
      "approvalMode": "allow",
      "ownerSurface": "repo",
      "description": "Validate enterprise app factory schemas, examples, docs, and env contract surfaces."
    },
    {
      "id": "enterprise-app-factory-ci",
      "name": "Enterprise App Factory CI",
      "command": "npm run ci --prefix services/enterprise-app-factory",
      "capability": "service.validate",
      "approvalMode": "allow",
      "ownerSurface": "repo",
      "description": "Run lint, typecheck, tests, and build for the Enterprise App Factory service."
    },
    {
      "id": "enterprise-app-factory-sample",
      "name": "Enterprise App Factory Sample",
      "command": "npm run sample --prefix services/enterprise-app-factory",
      "capability": "repo.mutate",
      "approvalMode": "prompt",
      "ownerSurface": "repo",
      "description": "Regenerate and verify the sample generated customer app workspace."
    },
    {
      "id": "enterprise-app-factory-council-sample",
      "name": "Enterprise App Factory Council Sample",
      "command": "npm run council:sample --prefix services/enterprise-app-factory",
      "capability": "repo.mutate",
      "approvalMode": "prompt",
      "ownerSurface": "repo",
      "description": "Run the bounded council sample review and persist the resulting agent-run evidence."
    },
    {
      "id": "downstream-sync-validate",
      "name": "Downstream Sync Validate",
      "command": "node scripts/validate-downstream-sync.mjs",
      "capability": "governance.validate",
      "approvalMode": "allow",
      "ownerSurface": "repo",
      "description": "Validate downstream sync manifests and schema alignment."
    },
    {
      "id": "capability-intake-validate",
      "name": "Capability Intake Validate",
      "command": "node scripts/validate-capability-intake.mjs",
      "capability": "governance.validate",
      "approvalMode": "allow",
      "ownerSurface": "repo",
      "description": "Validate governed external-capability intake catalogs."
    },
    {
      "id": "runtime-profile-validate",
      "name": "Runtime Profile Validate",
      "command": "node scripts/validate-runtime-topology-profiles.mjs",
      "capability": "runtime.validate",
      "approvalMode": "allow",
      "ownerSurface": "repo",
      "description": "Validate OpenClaw/NemoClaw runtime profile contracts."
    },
    {
      "id": "agentmail-runtime-validate",
      "name": "AgentMail Runtime Validate",
      "command": "node scripts/validate-agentmail-runtime.mjs",
      "capability": "service.validate",
      "approvalMode": "allow",
      "ownerSurface": "repo",
      "description": "Validate runtime-owned email identities, domain intent, and message envelopes."
    },
    {
      "id": "agentmail-doctor",
      "name": "AgentMail Doctor",
      "command": "node scripts/agentmail-doctor.mjs",
      "capability": "runtime.inspect",
      "approvalMode": "allow",
      "ownerSurface": "host",
      "description": "Inspect declared AgentMail readiness and remaining live proof gaps."
    },
    {
      "id": "agentmail-live-check",
      "name": "AgentMail Live Check",
      "command": "node scripts/agentmail-live-check.mjs",
      "capability": "network.authenticated.read",